review,rating,date,product_name,category,scraped_date
"Kalo ditanya isiny banyak gk ? 
Isi ny banyak ,, gk ngitung dpt brp pokokny bnyk , terus empuk bngt ..
Tp rasany hambar bangettt ,,
Jadi harus ditambah penyedap , saos ti...",bintang 5,2 hari lalu,OSENG MERCON KOYOR TETELAN SAPI PEDAS SIAP MAKAN - KOYOR OTOT,Makanan_minuman,2025-06-25 16:33:32
"Paket nya sdh Dateng cepat aman , tuk rasa ku blom tau ,blom di coba , mudah2an enak next order lg 👍🥰",bintang 5,3 bulan lalu,OSENG MERCON KOYOR TETELAN SAPI PEDAS SIAP MAKAN - KOYOR OTOT,Makanan_minuman,2025-06-25 16:33:32
mantaapz enaak bgt gaeeez isi'a pun byk bs di makan tuk 2-3 org pedes'a cucook kemasan'a bgs lucuu uniik pke plastik ky undangan nikahan..wkwkwk,bintang 5,7 bulan lalu,OSENG MERCON KOYOR TETELAN SAPI PEDAS SIAP MAKAN - KOYOR OTOT,Makanan_minuman,2025-06-25 16:33:32
Pesenan sudah sampai dengan cepat dan aman. Endulita pedes top,bintang 5,1 minggu lalu,OSENG MERCON KOYOR TETELAN SAPI PEDAS SIAP MAKAN - KOYOR OTOT,Makanan_minuman,2025-06-25 16:33:32
Kalau rasa sih enak banget..cuma sayank isi lemak nya hancur cuma dapet minyak sama bumbu aja..tolong kualitas nya di perhatikan biar yg beli puas.,bintang 4,4 bulan lalu,OSENG MERCON KOYOR TETELAN SAPI PEDAS SIAP MAKAN - KOYOR OTOT,Makanan_minuman,2025-06-25 16:33:32
Paket udah nyampek dn baru bs review pakingx rapi & cantik banget👍👍👍semoga rasa'x juga sama seperti pakingx🥰🥰🥰,bintang 5,2 bulan lalu,OSENG MERCON KOYOR TETELAN SAPI PEDAS SIAP MAKAN - KOYOR OTOT,Makanan_minuman,2025-06-25 16:33:32
oseng merconnya enak banget bumbu dan koyornya banyak rasa top bisa dibawa pergi ke luar kota tuk dimakan di jalan  terima kasih seller dan kurirnya,bintang 5,1 bulan lalu,OSENG MERCON KOYOR TETELAN SAPI PEDAS SIAP MAKAN - KOYOR OTOT,Makanan_minuman,2025-06-25 16:33:32
"Bumbunya banyak, meresap ke koyor & otot. Koyornya lembut & ototnya empuk & tidak bau prengus. Sangat rekomen, gak cukup cuma beli 1.
Sempat ada kendala di pr...",bintang 5,1 bulan lalu,OSENG MERCON KOYOR TETELAN SAPI PEDAS SIAP MAKAN - KOYOR OTOT,Makanan_minuman,2025-06-25 16:33:32
"Kemasan bagus dan rapi , keterangannya lengkap , rasa enak",bintang 5,2 bulan lalu,OSENG MERCON KOYOR TETELAN SAPI PEDAS SIAP MAKAN - KOYOR OTOT,Makanan_minuman,2025-06-25 16:33:32
"Kemasan bagus dan rapi , keterangannya lengkap , rasa enak",bintang 5,2 bulan lalu,OSENG MERCON KOYOR TETELAN SAPI PEDAS SIAP MAKAN - KOYOR OTOT,Makanan_minuman,2025-06-25 16:33:32
Rasanya enak sekali tidak keras koyor ototnya,bintang 5,2 bulan lalu,OSENG MERCON KOYOR TETELAN SAPI PEDAS SIAP MAKAN - KOYOR OTOT,Makanan_minuman,2025-06-25 16:33:36
"Baru di buka pkt nya, RS oke cuma pds nya aku  g kuat , kt  anak  pas  pds nya nya",bintang 5,4 bulan lalu,OSENG MERCON KOYOR TETELAN SAPI PEDAS SIAP MAKAN - KOYOR OTOT,Makanan_minuman,2025-06-25 16:33:36
Se endulll ini makan pakai nasi putih hangat dan langsung di uwek2 hmmmm mantappp banget enakkkk 😋😋,bintang 5,1 bulan lalu,OSENG MERCON KOYOR TETELAN SAPI PEDAS SIAP MAKAN - KOYOR OTOT,Makanan_minuman,2025-06-25 16:33:36
"Kualitas produk: Bagus fresh
Dibeli ya Oseng Merconnya. Trimakasih",bintang 5,5 bulan lalu,OSENG MERCON KOYOR TETELAN SAPI PEDAS SIAP MAKAN - KOYOR OTOT,Makanan_minuman,2025-06-25 16:33:36
"🌶️Kepedasan：sangat pedas dan enak sekali
🍲Rasa：sangat enak untuk sambelnya beneran dan enak banget deh
Terima kasih banyak seller",bintang 5,3 bulan lalu,OSENG MERCON KOYOR TETELAN SAPI PEDAS SIAP MAKAN - KOYOR OTOT,Makanan_minuman,2025-06-25 16:33:36
Belum dicoba.. Semoga rasanya enak.. Kalo bis updtE nti q update. Packagingnya sangat top. Cuma mgkin next di kemasan dalamnya jg dituliz jd klo masuk kulkas tau mana koy...,bintang 5,1 bulan lalu,OSENG MERCON KOYOR TETELAN SAPI PEDAS SIAP MAKAN - KOYOR OTOT,Makanan_minuman,2025-06-25 16:33:36
Belum dicoba.. Semoga rasanya enak.. Kalo bis updtE nti q update. Packagingnya sangat top. Cuma mgkin next di kemasan dalamnya jg dituliz jd klo masuk kulkas tau mana koy...,bintang 5,1 bulan lalu,OSENG MERCON KOYOR TETELAN SAPI PEDAS SIAP MAKAN - KOYOR OTOT,Makanan_minuman,2025-06-25 16:33:36
"kalau bisa sih di kasih daging y,,biar rasa y ngk terlalu enek mkn ya,soal rasa enak,,peras y nampol👍",bintang 4,1 bulan lalu,OSENG MERCON KOYOR TETELAN SAPI PEDAS SIAP MAKAN - KOYOR OTOT,Makanan_minuman,2025-06-25 16:33:36
"Jujur ya ini enak bgt… ak yg pernah coba koyor b*l*s*g* yg pedes tapi lebih ke manis, lebih suka ini ga manis. Cuman kurang empuk aja kak. Harga wort it untuk cuman penge...",bintang 5,2 bulan lalu,OSENG MERCON KOYOR TETELAN SAPI PEDAS SIAP MAKAN - KOYOR OTOT,Makanan_minuman,2025-06-25 16:33:36
"Aneh rasanya, malah kayak aci sih kataku, tapi packkingnya cakep👍",bintang 4,1 bulan lalu,OSENG MERCON KOYOR TETELAN SAPI PEDAS SIAP MAKAN - KOYOR OTOT,Makanan_minuman,2025-06-25 16:33:36
Alhamdulillah barang sampai dengan aman dan packaging rapih dan rasanya enaaaak banget,bintang 5,1 bulan lalu,OSENG MERCON KOYOR TETELAN SAPI PEDAS SIAP MAKAN - KOYOR OTOT,Makanan_minuman,2025-06-25 16:33:41
"Oseng mercon datang pas tepat waktu. Lsg unboxing dan dihangatkan untuk sarapan pagi. Rasa pedas nya mantap, lauknya empuk",bintang 5,2 bulan lalu,OSENG MERCON KOYOR TETELAN SAPI PEDAS SIAP MAKAN - KOYOR OTOT,Makanan_minuman,2025-06-25 16:33:41
"Enak banget, jadi terobati makanan indo, pedes nampol nagih, bakal repeat order LG makasi makijah",bintang 5,9 bulan lalu,OSENG MERCON KOYOR TETELAN SAPI PEDAS SIAP MAKAN - KOYOR OTOT,Makanan_minuman,2025-06-25 16:33:41
"Pedes nya mantap. Ini adalah pembelian ke 2, dan rasa masih tetap sama",bintang 5,2 bulan lalu,OSENG MERCON KOYOR TETELAN SAPI PEDAS SIAP MAKAN - KOYOR OTOT,Makanan_minuman,2025-06-25 16:33:41
"Sesuai pesanan, walaupun pengirimannya agak lama. Baru datang dan belum dicobain, semoga aja rasanya enak dan cocok",bintang 5,3 bulan lalu,OSENG MERCON KOYOR TETELAN SAPI PEDAS SIAP MAKAN - KOYOR OTOT,Makanan_minuman,2025-06-25 16:33:41
"Paket sudah sampai sesuai pesanan,,, wow packpagingnya bagus, rapi. Semoga rasanya tidak mengecewakan yaaaa. Terimakasih",bintang 5,1 bulan lalu,OSENG MERCON KOYOR TETELAN SAPI PEDAS SIAP MAKAN - KOYOR OTOT,Makanan_minuman,2025-06-25 16:33:41
"Paket sudah sampai sesuai pesanan,,, wow packpagingnya bagus, rapi. Semoga rasanya tidak mengecewakan yaaaa. Terimakasih",bintang 5,1 bulan lalu,OSENG MERCON KOYOR TETELAN SAPI PEDAS SIAP MAKAN - KOYOR OTOT,Makanan_minuman,2025-06-25 16:33:41
"Rasanya mantap, kemasan nya keren banget... 
Isi nya banyak, bisa utk maem 2x ☺🥰",bintang 5,5 bulan lalu,OSENG MERCON KOYOR TETELAN SAPI PEDAS SIAP MAKAN - KOYOR OTOT,Makanan_minuman,2025-06-25 16:33:41
Langsung  ditest mmg enak benar dan mantap...rugi gk nyoba,bintang 5,5 bulan lalu,OSENG MERCON KOYOR TETELAN SAPI PEDAS SIAP MAKAN - KOYOR OTOT,Makanan_minuman,2025-06-25 16:33:41
"Enak ototnya empuk bngt manteppp... Pedes gurih wangi daun jeruk
Kualitas produk: bagus",bintang 5,2 bulan lalu,OSENG MERCON KOYOR TETELAN SAPI PEDAS SIAP MAKAN - KOYOR OTOT,Makanan_minuman,2025-06-25 16:33:41
"Enak banget, bakalan jadi langganan ku untuk koyor ototnya, mantulita",bintang 5,1 bulan lalu,OSENG MERCON KOYOR TETELAN SAPI PEDAS SIAP MAKAN - KOYOR OTOT,Makanan_minuman,2025-06-25 16:33:47
"Enak bikin dower,dimakan ama nasi hangat luweh enak bikin diet gagal.🤭🤭🤭🤭",bintang 5,1 bulan lalu,OSENG MERCON KOYOR TETELAN SAPI PEDAS SIAP MAKAN - KOYOR OTOT,Makanan_minuman,2025-06-25 16:33:47
"koyornya agak kelembekkan, rasanya pedes polll, baru sampe langsung di eksekusi",bintang 4,9 bulan lalu,OSENG MERCON KOYOR TETELAN SAPI PEDAS SIAP MAKAN - KOYOR OTOT,Makanan_minuman,2025-06-25 16:33:47
Bocor dalam nya,bintang 3,7 bulan lalu,OSENG MERCON KOYOR TETELAN SAPI PEDAS SIAP MAKAN - KOYOR OTOT,Makanan_minuman,2025-06-25 16:33:47
Mantap koyor ototnya..sdh 3kl co...bener2 mantap..rugi gk co...lmyan buat 3piring,bintang 5,1 bulan lalu,OSENG MERCON KOYOR TETELAN SAPI PEDAS SIAP MAKAN - KOYOR OTOT,Makanan_minuman,2025-06-25 16:33:47
"Kurang rsa.ny...
Ni menurut sya,,gk tau orang lain.....😁😁",bintang 5,2 bulan lalu,OSENG MERCON KOYOR TETELAN SAPI PEDAS SIAP MAKAN - KOYOR OTOT,Makanan_minuman,2025-06-25 16:33:47
"rasanya enak, cocok di lidah saya. bumbu melimpah. pedasnya lumayan level tinggi.",bintang 5,2 bulan lalu,OSENG MERCON KOYOR TETELAN SAPI PEDAS SIAP MAKAN - KOYOR OTOT,Makanan_minuman,2025-06-25 16:33:47
"Pacakging bagus, pengiriman cepat, semoga rasanya juga ok.",bintang 5,1 bulan lalu,OSENG MERCON KOYOR TETELAN SAPI PEDAS SIAP MAKAN - KOYOR OTOT,Makanan_minuman,2025-06-25 16:33:47
"Alhamdulillah sampai juga, perjalanan jauh dr Surabaya ke Tangsel. Trims seller 👌",bintang 5,4 hari lalu,OSENG MERCON KOYOR TETELAN SAPI PEDAS SIAP MAKAN - KOYOR OTOT,Makanan_minuman,2025-06-25 16:33:47
Dtg hari ini 24 MEI pesen 21 ..SDH KESEKIAN  X gk di RAGUKAN enakkk SUKAA THE BEST POOL MANTAP  tks 🙏🏽   EXP AGUSTUS 2O25,bintang 5,1 bulan lalu,OSENG MERCON KOYOR TETELAN SAPI PEDAS SIAP MAKAN - KOYOR OTOT,Makanan_minuman,2025-06-25 16:33:47
"Gak seperti makan urat, kok lembek kayak sagu gitu ya",bintang 3,1 bulan lalu,OSENG MERCON KOYOR TETELAN SAPI PEDAS SIAP MAKAN - KOYOR OTOT,Makanan_minuman,2025-06-25 16:33:53
"Koyor ototnya lembek banget, gak suka.. tp kembali ke selera masing2..",bintang 3,1 bulan lalu,OSENG MERCON KOYOR TETELAN SAPI PEDAS SIAP MAKAN - KOYOR OTOT,Makanan_minuman,2025-06-25 16:33:53
Sudah d bayar 2 kok d kirim cuma 1 ...kok gitu ... Bayar mahal2 lo,bintang 2,5 bulan lalu,OSENG MERCON KOYOR TETELAN SAPI PEDAS SIAP MAKAN - KOYOR OTOT,Makanan_minuman,2025-06-25 16:33:53
"Enak,,Padahal aku GK suka makanan instan kyak gini tapi kalau ini bisa di bicarakan❤️",bintang 5,2 minggu lalu,OSENG MERCON KOYOR TETELAN SAPI PEDAS SIAP MAKAN - KOYOR OTOT,Makanan_minuman,2025-06-25 16:33:53
paket SDH mendarat dengan selamat kotor nya enak pedes nya pas bagi diriku yang suka pedas nek order lagi mksh seller,bintang 5,3 bulan lalu,OSENG MERCON KOYOR TETELAN SAPI PEDAS SIAP MAKAN - KOYOR OTOT,Makanan_minuman,2025-06-25 16:33:53
Paket dtg kemasan rapi cuman  tgl ekspayernya ga begitu jelas. Rasa blm di coba. Mudah2n tdk mengecewakan,bintang 3,2 bulan lalu,OSENG MERCON KOYOR TETELAN SAPI PEDAS SIAP MAKAN - KOYOR OTOT,Makanan_minuman,2025-06-25 16:33:53
Pengiriman cepat. Tanggal kadaluarsa masih lama. Mantap!,bintang 5,1 minggu lalu,OSENG MERCON KOYOR TETELAN SAPI PEDAS SIAP MAKAN - KOYOR OTOT,Makanan_minuman,2025-06-25 16:33:53
Paket SDH mendarat dengan selamat kotor nya enak pedes nya pas nek order lagi mksh seller,bintang 5,3 bulan lalu,OSENG MERCON KOYOR TETELAN SAPI PEDAS SIAP MAKAN - KOYOR OTOT,Makanan_minuman,2025-06-25 16:33:53
Bismillah semoga rasa'x TDK mengecewakan🥰🥰🥰,bintang 5,2 bulan lalu,OSENG MERCON KOYOR TETELAN SAPI PEDAS SIAP MAKAN - KOYOR OTOT,Makanan_minuman,2025-06-25 16:33:53
"Untuk ototnya lembut tp rasanya aneh,ga enak
Maav yaa tapi ini yang aku rasain",bintang 2,1 bulan lalu,OSENG MERCON KOYOR TETELAN SAPI PEDAS SIAP MAKAN - KOYOR OTOT,Makanan_minuman,2025-06-25 16:33:53
"Sudah diterima dengan baik koyor by Mak Ijah, terima kasih banyak🥰👍",bintang 5,2 bulan lalu,OSENG MERCON KOYOR TETELAN SAPI PEDAS SIAP MAKAN - KOYOR OTOT,Makanan_minuman,2025-06-25 16:33:58
ya allah bagus banget packingnya...alhamdulillah mantapp rasanya,bintang 5,3 bulan lalu,OSENG MERCON KOYOR TETELAN SAPI PEDAS SIAP MAKAN - KOYOR OTOT,Makanan_minuman,2025-06-25 16:33:58
Pengemasannya bagus rasanya enak,bintang 5,3 minggu lalu,OSENG MERCON KOYOR TETELAN SAPI PEDAS SIAP MAKAN - KOYOR OTOT,Makanan_minuman,2025-06-25 16:33:58
"Pesanan sudah diterima dengan baik, sesuai gambar",bintang 5,2 bulan lalu,OSENG MERCON KOYOR TETELAN SAPI PEDAS SIAP MAKAN - KOYOR OTOT,Makanan_minuman,2025-06-25 16:33:58
Belum dicobaaa semoga rasa kayak bintangnya.,bintang 5,1 bulan lalu,OSENG MERCON KOYOR TETELAN SAPI PEDAS SIAP MAKAN - KOYOR OTOT,Makanan_minuman,2025-06-25 16:33:58
"Untuk koyornya cukup empuk tapi masih kenyal, namun bumbunya terlalu kering dan bumbunya kurang sedap, sepertinya resep bumbunya menurut saya butuh banyak improove",bintang 4,2 minggu lalu,OSENG MERCON KOYOR TETELAN SAPI PEDAS SIAP MAKAN - KOYOR OTOT,Makanan_minuman,2025-06-25 16:33:58
"Koyornya enak, lembut, cuma keseluruhan gak ada rasa / aroma bawang kek, bumbu lain kek, cm koyor dan pedas saja.",bintang 4,6 hari lalu,OSENG MERCON KOYOR TETELAN SAPI PEDAS SIAP MAKAN - KOYOR OTOT,Makanan_minuman,2025-06-25 16:33:58
Enak banget makan lauk ini dengan nasi hangat bikin ketagihan dan mau nambah. Masakannya sedap dan ototnya juga super empuk dan sangat enak. Cocok dengan rasanya dan prak...,bintang 5,1 bulan lalu,OSENG MERCON KOYOR TETELAN SAPI PEDAS SIAP MAKAN - KOYOR OTOT,Makanan_minuman,2025-06-25 16:33:58
"Enak isi juga banyak, cuma agak manis sih menurut ku, rasa tomat nya juga kerasa banget",bintang 4,3 bulan lalu,OSENG MERCON KOYOR TETELAN SAPI PEDAS SIAP MAKAN - KOYOR OTOT,Makanan_minuman,2025-06-25 16:33:58
Enak tapi gatau kenapa agak ada rasa asem ntah bumbu nya kekencengan atau gimana tp overall enak,bintang 5,2 bulan lalu,OSENG MERCON KOYOR TETELAN SAPI PEDAS SIAP MAKAN - KOYOR OTOT,Makanan_minuman,2025-06-25 16:33:58
"Rasa enak dan pedas pas
Product quality: 90",bintang 5,1 bulan lalu,OSENG MERCON KOYOR TETELAN SAPI PEDAS SIAP MAKAN - KOYOR OTOT,Makanan_minuman,2025-06-25 16:34:04
"Kemasanny rapi,buble wrapny tebal msh d kasih lapis plastik sm kotak dus.kemasannya aluminium foil,meminimalisir kebocoran.
Kualitas produk: Mdh²n bagus.cz msh blm aku cb...",bintang 4,2 bulan lalu,OSENG MERCON KOYOR TETELAN SAPI PEDAS SIAP MAKAN - KOYOR OTOT,Makanan_minuman,2025-06-25 16:34:04
"Rada manis ya rasanya, komen di live hostnya nyuruh nambahin air ma garem biar ga manis,jawaban bodoh bgt. Dikritik kok malah songong",bintang 4,3 minggu lalu,OSENG MERCON KOYOR TETELAN SAPI PEDAS SIAP MAKAN - KOYOR OTOT,Makanan_minuman,2025-06-25 16:34:04
"Ternyata lebih enak ini, bumbunya bener2 terasa daun jeruknya jg, dan pengirimannya cepat bangets",bintang 5,2 bulan lalu,OSENG MERCON KOYOR TETELAN SAPI PEDAS SIAP MAKAN - KOYOR OTOT,Makanan_minuman,2025-06-25 16:34:04
"Sudah sampai , cepat kurir ny udh langganan tpi blm di cb ok",bintang 5,6 bulan lalu,OSENG MERCON KOYOR TETELAN SAPI PEDAS SIAP MAKAN - KOYOR OTOT,Makanan_minuman,2025-06-25 16:34:04
Kualitas produk: Rasanya enak dan koyornya banyak,bintang 5,1 bulan lalu,OSENG MERCON KOYOR TETELAN SAPI PEDAS SIAP MAKAN - KOYOR OTOT,Makanan_minuman,2025-06-25 16:34:04
"Koyor ototnya enak, cuma menurut saya ini terlalu empuk",bintang 5,1 bulan lalu,OSENG MERCON KOYOR TETELAN SAPI PEDAS SIAP MAKAN - KOYOR OTOT,Makanan_minuman,2025-06-25 16:34:04
Untuk packaging sangat aman. Tapi kalau unfuk rasa mnrut aku kurang medok ya bumbunya sama tekstur nya terlalu lunak,bintang 4,1 bulan lalu,OSENG MERCON KOYOR TETELAN SAPI PEDAS SIAP MAKAN - KOYOR OTOT,Makanan_minuman,2025-06-25 16:34:04
"paket sampai sesuai estimasi, packing aman, masa exp date msh lama, rasa blm di coba krn blm di buka  buat bekel di jalan semoga enak sesuai harapan",bintang 5,2 bulan lalu,OSENG MERCON KOYOR TETELAN SAPI PEDAS SIAP MAKAN - KOYOR OTOT,Makanan_minuman,2025-06-25 16:34:04
"Enak, cobain sama lontong balap enak
Product quality: Kemasan Niat",bintang 5,2 bulan lalu,OSENG MERCON KOYOR TETELAN SAPI PEDAS SIAP MAKAN - KOYOR OTOT,Makanan_minuman,2025-06-25 16:34:04
Dagingnya kecil2 banget dan terlalu sedikit,bintang 5,1 bulan lalu,OSENG MERCON KOYOR TETELAN SAPI PEDAS SIAP MAKAN - KOYOR OTOT,Makanan_minuman,2025-06-25 16:34:09
"Koyor uratnye terlalu empuk , harusnya ada varian rasa pedas sedikit untuk yg tidak suka pedas , rasanya lumayan",bintang 4,3 bulan lalu,OSENG MERCON KOYOR TETELAN SAPI PEDAS SIAP MAKAN - KOYOR OTOT,Makanan_minuman,2025-06-25 16:34:09
Barang diterima dengan baik makasi seller,bintang 5,1 bulan lalu,OSENG MERCON KOYOR TETELAN SAPI PEDAS SIAP MAKAN - KOYOR OTOT,Makanan_minuman,2025-06-25 16:34:09
Barang diterima dengan baik makasi seller,bintang 5,1 bulan lalu,OSENG MERCON KOYOR TETELAN SAPI PEDAS SIAP MAKAN - KOYOR OTOT,Makanan_minuman,2025-06-25 16:34:09
Real otot yg kenyal suka banget karna biasannya bukan kenyal” gini kalo beli di toko lain melainkan lemak. Pedes nya lumayan berasa tapi bukan yg pedes banget. Bumbu nya...,bintang 4,2 bulan lalu,OSENG MERCON KOYOR TETELAN SAPI PEDAS SIAP MAKAN - KOYOR OTOT,Makanan_minuman,2025-06-25 16:34:09
"rasa nya mantap
otot nya besar²
bener² enak",bintang 4,1 bulan lalu,OSENG MERCON KOYOR TETELAN SAPI PEDAS SIAP MAKAN - KOYOR OTOT,Makanan_minuman,2025-06-25 16:34:09
"Urat lebih kecil dari yg di promosikan di video dan terlalu lunak sehingga tidak ada rasa kenyal untuk menggigit. Juga rasa cenderung asam, apa mungkin karna telat di pen...",bintang 3,1 bulan lalu,OSENG MERCON KOYOR TETELAN SAPI PEDAS SIAP MAKAN - KOYOR OTOT,Makanan_minuman,2025-06-25 16:34:09
Product quality: rasa enak! tapi otot mya masih ada yg suka keras! enak enak!,bintang 3,3 bulan lalu,OSENG MERCON KOYOR TETELAN SAPI PEDAS SIAP MAKAN - KOYOR OTOT,Makanan_minuman,2025-06-25 16:34:09
"Pedasnya terasa ,, pokoknya nendang banget",bintang 5,9 bulan lalu,OSENG MERCON KOYOR TETELAN SAPI PEDAS SIAP MAKAN - KOYOR OTOT,Makanan_minuman,2025-06-25 16:34:09
Pedasnya menyala dan enak banget. Bakal beli lagi,bintang 5,2 bulan lalu,OSENG MERCON KOYOR TETELAN SAPI PEDAS SIAP MAKAN - KOYOR OTOT,Makanan_minuman,2025-06-25 16:34:09
Dagingnya kecil2 banget dan terlalu sedikit,bintang 5,1 bulan lalu,OSENG MERCON KOYOR TETELAN SAPI PEDAS SIAP MAKAN - KOYOR OTOT,Makanan_minuman,2025-06-25 16:34:14
"Koyor uratnye terlalu empuk , harusnya ada varian rasa pedas sedikit untuk yg tidak suka pedas , rasanya lumayan",bintang 4,3 bulan lalu,OSENG MERCON KOYOR TETELAN SAPI PEDAS SIAP MAKAN - KOYOR OTOT,Makanan_minuman,2025-06-25 16:34:14
Barang diterima dengan baik makasi seller,bintang 5,1 bulan lalu,OSENG MERCON KOYOR TETELAN SAPI PEDAS SIAP MAKAN - KOYOR OTOT,Makanan_minuman,2025-06-25 16:34:14
Barang diterima dengan baik makasi seller,bintang 5,1 bulan lalu,OSENG MERCON KOYOR TETELAN SAPI PEDAS SIAP MAKAN - KOYOR OTOT,Makanan_minuman,2025-06-25 16:34:14
Real otot yg kenyal suka banget karna biasannya bukan kenyal” gini kalo beli di toko lain melainkan lemak. Pedes nya lumayan berasa tapi bukan yg pedes banget. Bumbu nya...,bintang 4,2 bulan lalu,OSENG MERCON KOYOR TETELAN SAPI PEDAS SIAP MAKAN - KOYOR OTOT,Makanan_minuman,2025-06-25 16:34:14
"rasa nya mantap
otot nya besar²
bener² enak",bintang 4,1 bulan lalu,OSENG MERCON KOYOR TETELAN SAPI PEDAS SIAP MAKAN - KOYOR OTOT,Makanan_minuman,2025-06-25 16:34:14
"Urat lebih kecil dari yg di promosikan di video dan terlalu lunak sehingga tidak ada rasa kenyal untuk menggigit. Juga rasa cenderung asam, apa mungkin karna telat di pen...",bintang 3,1 bulan lalu,OSENG MERCON KOYOR TETELAN SAPI PEDAS SIAP MAKAN - KOYOR OTOT,Makanan_minuman,2025-06-25 16:34:14
Product quality: rasa enak! tapi otot mya masih ada yg suka keras! enak enak!,bintang 3,3 bulan lalu,OSENG MERCON KOYOR TETELAN SAPI PEDAS SIAP MAKAN - KOYOR OTOT,Makanan_minuman,2025-06-25 16:34:14
"Pedasnya terasa ,, pokoknya nendang banget",bintang 5,9 bulan lalu,OSENG MERCON KOYOR TETELAN SAPI PEDAS SIAP MAKAN - KOYOR OTOT,Makanan_minuman,2025-06-25 16:34:14
Pedasnya menyala dan enak banget. Bakal beli lagi,bintang 5,2 bulan lalu,OSENG MERCON KOYOR TETELAN SAPI PEDAS SIAP MAKAN - KOYOR OTOT,Makanan_minuman,2025-06-25 16:34:14
"Mantap pedes nampol kinyil2 , solusi disaat butuh sat set",bintang 5,1 bulan lalu,OSENG MERCON KOYOR TETELAN SAPI PEDAS SIAP MAKAN - KOYOR OTOT,Makanan_minuman,2025-06-25 16:34:18
Alhmdlh oaket oseng merconny sdh dicicipi rasany enak dan lunak hanya bagi lidah sy aroma daun jerukny terlalu kuat..trmksh,bintang 5,1 bulan lalu,OSENG MERCON KOYOR TETELAN SAPI PEDAS SIAP MAKAN - KOYOR OTOT,Makanan_minuman,2025-06-25 16:34:18
Sebenernya ini enak ototnya kenyal cuma terasinya aja strong banget😭😭😭 bener bener dominan terasinya,bintang 4,5 hari lalu,OSENG MERCON KOYOR TETELAN SAPI PEDAS SIAP MAKAN - KOYOR OTOT,Makanan_minuman,2025-06-25 16:34:18
uenak poll. bumbunya pas. pedesnya nampoll..potongan koyornya guede2.. like like like👍,bintang 5,9 bulan lalu,OSENG MERCON KOYOR TETELAN SAPI PEDAS SIAP MAKAN - KOYOR OTOT,Makanan_minuman,2025-06-25 16:34:18
"Mantaaff....🤗🤗🤗
Kualitas produk: Enak...empuuk koyornya👍👍👍",bintang 5,1 bulan lalu,OSENG MERCON KOYOR TETELAN SAPI PEDAS SIAP MAKAN - KOYOR OTOT,Makanan_minuman,2025-06-25 16:34:18
Rasanya enak. Pedasnya pas. Daging koyor ototnya amoh.,bintang 5,1 bulan lalu,OSENG MERCON KOYOR TETELAN SAPI PEDAS SIAP MAKAN - KOYOR OTOT,Makanan_minuman,2025-06-25 16:34:18
"Wahhh kemasan prepare bgttt pernah beli d bolosego tp kemasan ga se prepare ini, rasa jg enak potongan gede, uhh mantap😍",bintang 5,1 bulan lalu,OSENG MERCON KOYOR TETELAN SAPI PEDAS SIAP MAKAN - KOYOR OTOT,Makanan_minuman,2025-06-25 16:34:18
"Kemasan rapi , rasa belum tau karena blm di makan",bintang 5,4 bulan lalu,OSENG MERCON KOYOR TETELAN SAPI PEDAS SIAP MAKAN - KOYOR OTOT,Makanan_minuman,2025-06-25 16:34:18
Mantul koyornya empuk bangt bikin ketagihan,bintang 5,1 bulan lalu,OSENG MERCON KOYOR TETELAN SAPI PEDAS SIAP MAKAN - KOYOR OTOT,Makanan_minuman,2025-06-25 16:34:18
"Kmasan bagus, pngiriman aman, packingx jg rapi tp utk raaa blm d coba n smg sj cucok",bintang 4,5 bulan lalu,OSENG MERCON KOYOR TETELAN SAPI PEDAS SIAP MAKAN - KOYOR OTOT,Makanan_minuman,2025-06-25 16:34:18
